{
 "schema": "level/0.2",
 "id": "world",
 "state": "beta",
 "kind": "overworld",
 "level": 0,
 "title": {
  "zh": "世界地图",
  "en": "World map"
 },
 "entry": "realm_1",
 "aspect": 2.364,
 "settings": {
  "title": {
   "zh": "世界地图",
   "en": "World map"
  },
  "words": []
 },
 "nodes": [
  {
   "id": "realm_1",
   "idx": 0,
   "kind": "portal",
   "x": 0.05,
   "y": 0.95,
   "title": {
    "zh": "新手草原",
    "en": "Starter Meadow"
   },
   "inBuild": true
  },
  {
   "id": "realm_2",
   "idx": 1,
   "kind": "portal",
   "x": 0.1625,
   "y": 0.8375,
   "title": {
    "zh": "蜂巢森林",
    "en": "Honeycomb Forest"
   },
   "inBuild": true
  },
  {
   "id": "realm_3",
   "idx": 2,
   "kind": "portal",
   "x": 0.275,
   "y": 0.725,
   "title": {
    "zh": "十字路口集市",
    "en": "Crossroads Market"
   },
   "inBuild": false
  },
  {
   "id": "realm_4",
   "idx": 3,
   "kind": "portal",
   "x": 0.3875,
   "y": 0.6125,
   "title": {
    "zh": "哥布林洞穴",
    "en": "Goblin Caves"
   },
   "inBuild": false
  },
  {
   "id": "realm_5",
   "idx": 4,
   "kind": "portal",
   "x": 0.5,
   "y": 0.5,
   "title": {
    "zh": "九头蛇沼泽",
    "en": "Hydra Swamp"
   },
   "inBuild": false
  },
  {
   "id": "realm_6",
   "idx": 5,
   "kind": "portal",
   "x": 0.6125,
   "y": 0.3875,
   "title": {
    "zh": "僵尸之地",
    "en": "Zombie Lands"
   },
   "inBuild": false
  },
  {
   "id": "realm_7",
   "idx": 6,
   "kind": "portal",
   "x": 0.725,
   "y": 0.275,
   "title": {
    "zh": "狮鹫山峰",
    "en": "Griffin Peaks"
   },
   "inBuild": false
  },
  {
   "id": "realm_8",
   "idx": 7,
   "kind": "portal",
   "x": 0.8375,
   "y": 0.1625,
   "title": {
    "zh": "食人魔角斗场",
    "en": "Ogre Colosseum"
   },
   "inBuild": false
  },
  {
   "id": "realm_9",
   "idx": 8,
   "kind": "portal",
   "x": 0.95,
   "y": 0.05,
   "title": {
    "zh": "魔王城",
    "en": "Demon King's Castle"
   },
   "inBuild": false
  }
 ],
 "edges": [
  {
   "id": "x_realm_1",
   "from": "realm_1",
   "kind": "portal",
   "to": {
    "graph": "realm_1",
    "node": "village"
   },
   "idx": 0
  },
  {
   "id": "x_realm_2",
   "from": "realm_2",
   "kind": "portal",
   "to": {
    "graph": "realm_2",
    "node": "entry_town"
   },
   "idx": 1
  },
  {
   "id": "x_realm_3",
   "from": "realm_3",
   "kind": "portal",
   "to": {
    "graph": "realm_3",
    "node": "entry_town"
   },
   "idx": 2
  },
  {
   "id": "x_realm_4",
   "from": "realm_4",
   "kind": "portal",
   "to": {
    "graph": "realm_4",
    "node": "entry_town"
   },
   "idx": 3
  },
  {
   "id": "x_realm_5",
   "from": "realm_5",
   "kind": "portal",
   "to": {
    "graph": "realm_5",
    "node": "entry_town"
   },
   "idx": 4
  },
  {
   "id": "x_realm_6",
   "from": "realm_6",
   "kind": "portal",
   "to": {
    "graph": "realm_6",
    "node": "entry_town"
   },
   "idx": 5
  },
  {
   "id": "x_realm_7",
   "from": "realm_7",
   "kind": "portal",
   "to": {
    "graph": "realm_7",
    "node": "entry_town"
   },
   "idx": 6
  },
  {
   "id": "x_realm_8",
   "from": "realm_8",
   "kind": "portal",
   "to": {
    "graph": "realm_8",
    "node": "entry_town"
   },
   "idx": 7
  },
  {
   "id": "x_realm_9",
   "from": "realm_9",
   "kind": "portal",
   "to": {
    "graph": "realm_9",
    "node": "entry_town"
   },
   "idx": 8
  },
  {
   "id": "w12",
   "from": "realm_1",
   "to": "realm_2",
   "kind": "path",
   "danger": 0,
   "steps": 1,
   "terrain": "road",
   "idx": 9
  },
  {
   "id": "w23",
   "from": "realm_2",
   "to": "realm_3",
   "kind": "path",
   "danger": 0,
   "steps": 1,
   "terrain": "road",
   "idx": 10
  },
  {
   "id": "w34",
   "from": "realm_3",
   "to": "realm_4",
   "kind": "path",
   "danger": 0,
   "steps": 1,
   "terrain": "road",
   "idx": 11
  },
  {
   "id": "w45",
   "from": "realm_4",
   "to": "realm_5",
   "kind": "path",
   "danger": 0,
   "steps": 1,
   "terrain": "road",
   "idx": 12
  },
  {
   "id": "w56",
   "from": "realm_5",
   "to": "realm_6",
   "kind": "path",
   "danger": 0,
   "steps": 1,
   "terrain": "road",
   "idx": 13
  },
  {
   "id": "w67",
   "from": "realm_6",
   "to": "realm_7",
   "kind": "path",
   "danger": 0,
   "steps": 1,
   "terrain": "road",
   "idx": 14
  },
  {
   "id": "w78",
   "from": "realm_7",
   "to": "realm_8",
   "kind": "path",
   "danger": 0,
   "steps": 1,
   "terrain": "road",
   "idx": 15
  },
  {
   "id": "w89",
   "from": "realm_8",
   "to": "realm_9",
   "kind": "path",
   "danger": 0,
   "steps": 1,
   "terrain": "road",
   "idx": 16
  }
 ],
 "events": [],
 "quests": [],
 "scenes": {},
 "characters": [],
 "npcs": {}
}
